essay_id,essay_set,essay,rater1_domain1,rater2_domain1,rater3_domain1,domain1_score,rater1_domain2,domain2_score,rater1_trait1,rater1_trait2,rater1_trait3,rater1_trait4,rater1_trait5,rater1_trait6,rater2_trait1,rater2_trait2,rater2_trait3,rater2_trait4,rater2_trait5,rater2_trait6,rater3_trait1,rater3_trait2,rater3_trait3,rater3_trait4,rater3_trait5,rater3_trait6
4604,2,"What happened to everyone having the right to have freedom of knoledge? I do not believe that certain materials should be removed only for the reason that someone finds it 'offensive' or 'inappropriate'. Our youth have the right to access these materials. Kids should have that right because it allows more access to knoledge, it provides more realistic details about life, and keeps them from being shut out from the world around them. We cannot deprive children of that.     First of all, all children and students at schools all over should have access to more knoledge. If certain materials are censored and taken away, they cannot access that type of learning. What if a student wants to learn more about how goverment and politics work by reading an an article. But then, the article is taken away because of one small comment in it. We cannot take away our aspiration to learn more about the world.     Secondly, it can give a more realistic image of a person, place, thing, or event. Explicit content can give children more details about how things really are in life. If that is taken away, they might have a different understanding of how things really are and have different expectations of things. This might have an emotional or psycalogical impact on them once they see the real world. They should be well informed of what life is like in further detail to avoid confusion once they get to that point.     Finally, they could be shut out from the world if everything is kept from them because of censorship. Being kept from that kind of knoledge can be an emotional strain. A friend of mine had parents that kept her from many things in the world around her, blinding her from what she should have known. As she got older, things became harder and harder for her. And now, she is affraid of many things out in the real world. This is all because her parents had used cencorship to keep her from knowing what was important.      Our students should always have access to knoledge, details about life, and not kept from knowing enough to have an undertanding of things in our modern world. We cannot allow censorship to make such irrational descisions about what we do and do not have access to. And if it has such a negative impact on society and our youth, why isn't it censored",4,4,,4,4.0,4.0,,,,,,,,,,,,,,,,,,
3598,2,"Reading it is a joy to some and a pain to others. Do I think objects in the library with offensive details should be cleaned up or taken off the shelves? There are some things that could be censored, and others that wouldn't be worth using if it was censored. However, yes I do believe that there are items in the library that could be censored. I am going to tell you why they should be censored, and what should be censored.     The types of items in the library that shouldn't be cleaned up.  A perfect example of those items are historical documentaries or historical books they have no other way to get the information needed across to the reader or viewer. There are other types of library items in the library that could be censored. Like there are some magazines and movies that show uncensored scenes or pages that are not need to make a view across if there even is a view to get across. I think a movie, book, or a magazine should only be uncensored if it is trying to get a point across. If there are uncensored items not getting a point across then they have no business being in the library.      As people can see library there are circumstances where a book, movie, or magazine uncensored is very useful in getting information. There are more circumstances where a library item does not need uncensored details because it is just offensive. If you ask me if I think censorship is important in libraries than I would have to say yes and no. I just gave you some reasons why I would say that. The next time you are in the library looking for a book ask your self one question is it to offensive to be important.",3,3,,3,3.0,3.0,,,,,,,,,,,,,,,,,,
18040,7,"One day I was at a baseball game in @LOCATION1 and the line was huge it stretch out for half a mile and we were at the end. So it took us about an hour to get up there so I had to be very very patient or else my dad would’ve gone crazy, so that’s my story about patience.",5,4,,9,,,1.0,1.0,1.0,2.0,,,1.0,1.0,1.0,1.0,,,,,,,,
3077,2,"It seems you cannot always make everyone happy. No matter what, someone is offended or upset over something. This holds true with everything- including media. Whether it be a book, movie, or a song, someone somewhere will be unhappy with it for some reason. Though this is true, it certainly does not mean you can take that media away from those who enjoy it. The @CAPS1 @CAPS2 of the @LOCATION1 @LOCATION1 @CAPS3 @LOCATION1 that all people are granted freedom of speech and freedom of press. Would taking 'offensive' material off of shelves not take away from this right so clearly and intently given to us? Not only that, but does sheltering the public and making us all believe the world is a place without bias, prejudice, or slander really help us in the grand scheme of things? Pretending that the world is perfect ensures that future generations of the world will be devestated by reality once they get out in the real world and realize everything is not perfect and nice and unbiased all the time.     My ninth grade year in high school, I read 'To @CAPS4 A @CAPS5' by @PERSON1. This book demonstrates the harsh prejudice that used to be normal in the @LOCATION4 during the earlier years of the @LOCATION1. This book could certainly be considered offensive by a person living in the southern @LOCATION1; one could say this book steriotypes people in the @LOCATION4. One could also say this book is offensive because of the language it uses. African-@CAPS6 could be offended by the explicit rascist comments and names within the pages. Despite this, 'To @CAPS4 A @CAPS5' is considered a classic and is praised and tought throughout the @LOCATION1 and the rest of the world. I grew from reading @PERSON1's masterpiece- it tought me a lot about where the @LOCATION1 has been and how far it has come with acceptance of other races. You learn from your mistakes, they say. Therefore, we can learn from the media's mistakes. We can grow as people from being offended or having offensive material brought to our attention. We can stop history from repeating itsself by being well-informed.     Theology is a huge matter of dispute among all cultures; @CAPS9 or @CAPS10'ite, @LOCATION2, @CAPS11, @LOCATION3, @LOCATION5, @CAPS12. Any book store you walk into, you can find a bible or a book on atheism or even '@ORGANIZATION1,' which focuses on @CAPS13. Any music store you walk into, you can find bands that bash the ideas of religion, but you can also find theistic worship bands or meditating music. Just the same, any movie theater or movie store you visit could supply movies with anti-theistic or pro-theistic themes.Taking such things off of the shelves because one work could be offensive to a group of people could limit another's options to explore theology and find out what suits them. It could limit one's exploration of interests. It could very well take away from one's personal growth.     In any case, it is unfair to take something that could be considered offensive to one person away from another just for the sake of being nice and having discretion. Putting a ban on certain works could harm the flow of society. Putting a ban on certain works could limit one's awareness of the world around them or the history they could potentially be inspired by, it could limit the expansion of one's intellect, it could take away from one's exploration of interests or the search of who they really are or want to be. It is best to just keep things the way they are- free.",5,4,,5,4.0,4.0,,,,,,,,,,,,,,,,,,
15113,6,The obstacles the builders of the empire state face was trying to make sure the building don't fall down.,0,0,,0,,,,,,,,,,,,,,,,,,,,
10133,4,"The author concludes the story with this paragraph because he’s saying that once winter and spring’s over and the hibiscus is budding, then I’ll start over again and try again. The author is saying saeng can’t wait till spring so she can plant her own little garden. This is why I think the author concludes the story with this paragraph.",1,1,,1,,,,,,,,,,,,,,,,,,,,
9689,4,"She vowed this paragraph because she wanted to make her mother proud by passing the test after she had failed it, but she waits for the plant to go through and start budding. The hibiscus buddy is like a new start so it makes it through winter and it will pass the test and then Saeng will be able to pass as well because she knows a tropick plant was able to survive a harsh winter then she can survive / pass the test the next spring.",1,2,,2,,,,,,,,,,,,,,,,,,,,
9543,4,"The author concludes the story with that paragraph, because she is making a promise to herself to take the test again so she can pass it. She will do it when it is spring with the hibiscus is budding. She need to take the test and start driving. I think that is a good thing to when people vowed thing to themself.",1,1,,1,,,,,,,,,,,,,,,,,,,,
15749,6,"The obstacles the builders of the Empire State Building faced is dirigibles were docked by means of an electric winch, which hauled in a line from the front of the ship and then tied it to a mast.",1,0,,1,,,,,,,,,,,,,,,,,,,,
1198,1,"Dear to whom this @MONTH1 concern I know everybody that dont uses computers are why are people effect by the computers. Well i think computer is better then newspaper, on news papers you could find the news, well of course but wheather, houses for sale, tv casting, jobs and others just the same way as @CAPS1 but instead it like virtual. It benefits society for certain reasons it depends. some times computerscan be a negative effects on people but it also teach people how to read, write, type, learn and other. What I about we can talk to others we can see pictures of people whom we no we can google into about things we need to no, it helps when they need to find they way around the mapquest. A negative issue with having computers with internet, certain websites that are not age able. Kids be on website thier parents dont bout, looking up with boys they meet over the @CAPS1, People dying making plans with someone the next day the person is gone missing. I think if experts take away computers must kids well be mad and upset and there will be nothing more to do but play video games and go outside and these are my opinions.",3,4,,7,,,,,,,,,,,,,,,,,,,,
15900,6,"The builders of the Empire State Building faced three main challenges while attempting to make the mooring mast accessible to derigibles. Most foreign derigibles still used hydrogen; a highly flammable gas. A fire on the streets of New York would be disastrous. There were also fierce, ever changing wind currents above the building. These winds would make the back of the dirigible ""swivel around and around the mooring mast."" @CAPS1, there was a law in place preventing dirigibles from flying too low when over urban areas. This law made it illegal for dirigibles to tether to the building or even approach it. Those three factors made the mooring mast ""neither practical nor safe.""",3,3,,3,,,,,,,,,,,,,,,,,,,,
88,1,"Dear Newspaper, ""@CAPS1 no!' I forgot the deffinition to this homework problem and I don’t have my notes. Now, in this situation a computer would be very helpful to just type in the word and get a whole bunch of results. This is why I believe having access to a computer at all times is very helpfull because you can find information that you've been needing. You can get in touch with a friend if you need to or just to talk to lostly if you are just sitting around and having nothing to do you can just go on the computer and discover things you @MONTH1 not have known. Having access to a computer is a real and very helpfull because if your just having a conversation with someone and you forget a name of an important fact you want to tell them, you can always just look it up. For me, a lot of the times I just need information about maybe a sports player of facts about a famous event. Since our technology is so up to date the computer is right there sitting with many of the helpfull facts we would like to know. Friends are a big part of my life and I love just to talk to them and see how they are doing. Again, our technology is so advanced now that there is a bunch of websites where we can talk and see how we are doing. A big reason why being able to talk to friends and family is helpful is for taking to people that are very far away and the ones you dont normally see. On a computer you can talk to people from not only all over the @CAPS2.S.A but even in other countrys! Finally, the times I find having a computer around me most helpfull is when I am just bored with nothing to do! I can just visit a whole bunch of educational websites on things I @MONTH1 have learned in school or wanted to learn. On the internet there are many things to keep you occupied like games or ou can even watch movies from your home onto the computer! If you have a computer around your house you should not be bored because there is many things you can be doing or even learning! Having a computer around your house is so helpfull, you can have fun but your even learning how to be good with technology at the same time. Computers are the future and its a good one. So I suggest you pick one up and just have a blast, you wont be sorry.",4,5,,9,,,,,,,,,,,,,,,,,,,,
18717,7,"Patience is a key role in life. If you are not paitent, you will live an unhappy life. Almost everything in life calls for patience. If you are not patient, you will most likely arrous something up like your job if you are not patient with your boss or co- workers. I often have a hard time being patient with my mom and dad. Sometimes I just can’t stand my parents anymore and I lose my temper and become impatient with them and that usually makes things worse for me. I do love my brother but he can get really annoying, like most little brothers and sisters do. When my brother gets on my nerves, I become very impatient with him. Sometimes I will get so mad and impatient with him I will just lose it and I always get in trouble when I beat on him and I would always end up being the bad guy because of my patience. Now that I am older and I realize how important it is to be patient with people, it makes life a whole lot easier and fun with the people. I’m around everyday and that is why when you are patient, you will get your way, but when you are impatient because you are trying to get yor way, it will never happen.",7,5,,12,,,0.0,2.0,2.0,3.0,,,1.0,1.0,1.0,2.0,,,,,,,,
3443,2,"Censorship or not? That is the question. Many people @MONTH1 not realize it, but what they read and watch greatly affects them. If children watch a scary movie, then nightmares seem to occur more often. If teens read a book where parties seem cool and bad  things are glorified, they too start to see bad as good. What if @CAPS2 article you are reading right now contained offensive language and inappropriate ideas? Most people would be offended and complain. I fyou saw an old man walking down the street yelling out obtrusive things, you would be mad and tell him to quit. So then the question is arised, why is it alright for us to watch movies like @CAPS2? Yes, books and movies should be censored.     Children are very naive at a young age. When a child starts getting exposed to violence, illegal acts, alcohol and drugs in books or movies, they start to think it's okay. For instance, when I was younger, I watched the movie '@CAPS1.' @CAPS2 movie contains a profanity every other word, so it seems. I saw my favorite actors on @CAPS2 movie saying bad words, so I figured it was alright. It's not okay for a child to talk offensively like that. One day I even heard a little @LOCATION2 quoting lines from the '@CAPS3.' @CAPS2 movie is hilarious but extremely suggestive. It made me sad to hear an innocent little @LOCATION2 talking about things that are way over his head.      Teenagers that listen to music from @LOCATION1 or @LOCATION2 are getting bad messages. Although these two rappers are seen as modern day music heroes, they shouldn't be glorified the way they are. They're songs are all about smoking weed and getting high. They make it seem cool. So teenagers think, '@CAPS5 if they can do it, so can I!' They start to engage in activities that were once frowned upon. If teenagers were't exposed to @CAPS2 kind of music, they wouldn't be as apt to take part in such things.      As for adults, their movies and books should be censored too. One @MONTH1 think that once they're older they can do waht they want, but that's not the case. Let me throw out an example to you. Let's just say a husband and wife are watching a movie together. It's great until a rather, inappropriate ,shall we say, scene comes on. Not only does it make things awkward, but it sends out the wrong message. When adults or unmarried people see their favorite actors being naughty on television, it makes it seem right. They start to lose the concept that you are supposed to remain abstinant until marriage. After all, it is the only way to remain free of any diseases.      If movies, books, magazines, and music continue to be left uncensored, the world will become a giant brouhaha. People will begin to lose the sense of what is right and what is wrong. We are on the brink of violence and total chaos. If we contiue to let our children and ourselves watch these types of movies and whatnot,things will get ugly. Yes, if libraries or stores find anything offensive on their racks, then they need to censor it before it corrupts any more minds",4,4,,4,4.0,4.0,,,,,,,,,,,,,,,,,,
4224,2,"People go to the library to find certain types of material. Some people get offended by some of the material and feel that it should be removed. Certain materials should not be removed if found offensive to others because it might not be offensive to someone else that might enjoy it. The offensive material can be history that the world need to know, such as racism. If they did not know the importance of slavery they wouldn't know of the past life and why we are treated the way we are being treated. History is a big part of life that everyone one should know. That's why we have history class to let us know of the history that we've been through.     All material don't have to be history that is offensive. Some material have sex and violence that is offensive. The libraries should have labels on every section to let people know what type of material it is. If people know what type of material it is and still choose to view it then they get what they ask for. It shouldn't be removed because they didn't like it. I learned in history class about wars that had violence in them that some of my classmates didn't like but that's what happened and we needed to know.     Materials are made for a reason. They should not be removed if found offensive to someone but not offensive to another. I read books in school with all kinds of violence and other things people @MONTH1 not like but it's history. History makes a difference in our lives and it's what we need. You can not removed that. If you find it offensive just don't view that material again.",3,3,,3,3.0,3.0,,,,,,,,,,,,,,,,,,
10537,4,I think he put this in here because. I think he’s trying to say when the snow melts just forget bout the first time. And when the geese return it your @NUM1 chance. Then the hibiscus budding is you get passed what you were trying to do.,1,1,,1,,,,,,,,,,,,,,,,,,,,
16352,6,"Ultimately, it is evident that the entire concept of Al @ORGANIZATION1 on the Empire State building was strategically flawed. It was Al Smith's dream, but dream is not always reality. In theory, the Mooring @ORGANIZATION3 would be constructed to dock drigibles. However, it was eventually revealed that a docking station on the Empire State building would never be possible. The reason Al Smith's dream could never prove to be reality is because Smith and the builders hit many obstacles. One obstacle faced with the construction of the @ORGANIZATION3 was the location. When a landing zone is 1,250 ft above ground level, it is extremely tough to test and complete a perfect landing zone, much tougher then if it was on ground level. Also, with location is the safety of having such high wind speeds at such an altitude. It is that the higher altitude @CAPS1 get the higher the air pressure and the ""violent air currents"" (@CAPS2 @NUM1) @CAPS1 will have, making a very unsafe environment. Next, another aspect of the location was the fact it was in densely populated New York City, if there were any mistakes a great number of casualties would be expected. Lastly, a large obstacle Smith and the builders faced was technology, in the @DATE1's and 1930's the amount of technology and engineering was certainly unparallel to the technology prevalent in today's society.",3,1,,3,,,,,,,,,,,,,,,,,,,,
9643,4,"The author ends the story with  “When they come back, in the spring, when the snows melt and the geese return and this hibiscus is budding, then I will take that test again” For many good reasons. Some reasons are, that she will keep moving on and adapting to her new life in Canada. She is going to change her way of life and try to fit in with her new culture. She is also going to have to relive the memory of her grandmother again and wants to handle it better. “ A wave of loss so deep and strong that it stung Saeng’s eye now swept over her.” She wants to be able to handle the loss better. The author wants to emphasize that the story is not yet over.      ",2,2,,2,,,,,,,,,,,,,,,,,,,,
6278,3,"The setting explains an early summer evening with some eccentric men. The mood that he would be in would probably be lively. “Like a foolish youth, the next morning I followed their advice…” (Kurmaskie) says that if you were very lively, I would take that as a way of being drunk without being drunk, and doing whatever someone thinks you should do without knowing you are being persuaded to do it.",1,1,,1,,,,,,,,,,,,,,,,,,,,
9105,4,"Why I think she added this is because she needs time to grow like the plant before she takes the test again. Sometimes you need more time to pass your test. going through school teaches more than stuff we need to know it helps us grow up, and how to understand life. I know myself as a tenth grader that I understand life more than I did in first. She still has a lot of growing mentaly about her past and preasnt.",1,1,,1,,,,,,,,,,,,,,,,,,,,
3211,2,"All people have the same right to read, listion and watch different materials. To be censored should be no one choise but your own. For some one else to tell you what and what not to read is by my openion very wrong to do. If we would censore everything we did we would have a city and nation that would @DATE1 slowly.   Any givein word can offend any certain person. The people that they offend are in my oppioen are the dead weights of our country that are just holding us back from fully ecpressing our self, the colorfull words that we @MONTH1 use can be offensive to one persson yet perfeectly fine to another. It all depends on the indivadual that likes or dislikes the word or readings. In my observations of people reading and dislikeing it because of it harsh and colorfull words is most offen people that do not fully express them selvs and our yet much more senitive. I think this also goes agenst freedom of speech. We were gaven that right so why wouldent we use it? Why wouldent people want us to express ourselvs? I have no idea why any person would want to take books,music,movies and magazines away from us. If every thing went by one mans rule of what to and not to read we would down grade as a country and @DATE1. Therefore i strongly advise not to take any books off the selves. The majordy of the people agree with me to not be censored and only the sensitive people that they offened will just make there own chiose not to pick the book off the selves,not to listen to music, And pick up the magazine. the right is ours and thats how is should stay",3,3,,3,3.0,3.0,,,,,,,,,,,,,,,,,,
16224,6,"The obstacles the builders faced in attempting to allow dirigibles to dock on top of the Empire State Building were building a mast, dirigibles docking on top of the building, and a law for dirigibles. The architects and builders spend a lot of time building the mooring mast on top of the Empire State Building. Dirigibles were trying to figure out how to dock to the building yet most dirigibles failed. A law the dirigibles were unable to dock on urban areas in case of a problem within the dirigibles. These were the obstacles the builders faced in an attempt to create a mast and allowing dirigibles to dock on top of the Empire State Building.",2,2,,2,,,,,,,,,,,,,,,,,,,,
9087,4,Saeng did not give up on herself. She said she would take it over again then she might pass it. You will not always pass on your first try it takes a while sometime. Saeng encourage you to never to give up just cause you did not get it on your first time. She also builds confidence in herself. That’s why the author concluded the story that way.,1,1,,1,,,,,,,,,,,,,,,,,,,,
