essay_id,essay_set,essay,rater1_domain1,rater2_domain1,rater3_domain1,domain1_score,rater1_domain2,domain2_score,rater1_trait1,rater1_trait2,rater1_trait3,rater1_trait4,rater1_trait5,rater1_trait6,rater2_trait1,rater2_trait2,rater2_trait3,rater2_trait4,rater2_trait5,rater2_trait6,rater3_trait1,rater3_trait2,rater3_trait3,rater3_trait4,rater3_trait5,rater3_trait6
18509,7,"Have you ever heard your mom or dad say patience is a virtue. Well I’ve heard it many times in my house actually too many times. Patience is a something that means you have to wait like when you wanna go see a new movie on opening night, you might have to wait in a big line cause it’s a new movie. So your gonna have wait with patience!",5,6,,11,,,0.0,1.0,2.0,2.0,,,0.0,2.0,2.0,2.0,,,,,,,,
6340,3,"The story Rough Road ahead: Do not exceed Posted Speed limit"" by Joe Kurmaskie was about a man traveling through some pretty difficult settings. The cyclist’s mood was detirmined by the setting as well as his needs and his detirmination to make it. The setting of the story early summer in California. The weather is described as hot as, ""The sun [began] to beat down."" He, ""was traveling through the high deserts of @CAPS1 can June."" Because of the excessive heat, he needed more water, which shortly became the conflict of this story. As things got more difficult his attitude towards the old men’s advice changed from gracious for their help to wishing he had never listened to them. Also as the difficulty increased his detirmination to move on also increased by, ""telling [himself] if [he] could make it that far, [he’d] be fine."" @CAPS2 for the cyclist, the settings affect was negitive.     ",3,2,,3,,,,,,,,,,,,,,,,,,,,
12232,5,"The mood in the memoir ""Narciso Rodriguez"" by @PERSON1 is very cozy and welcomeing. Inside the @PERSON1 home the @CAPS1 describes a cozy and friendly atmospher. ""Here, the innocence of childhood, the congregation of family and friends, and endless celebrations that encompassed bot, formed the backdrop to life in our warm home"". This quote shows how cozy or ""warm"" their home is. In the memoir he also explains how welcome people are and that everyone in the Apartment building was friends or even family! ""Growing up in this environment instilled in me the great sence that ""family"" had nothing to do with being a blood relative."" This quote means that in his welcomeing home friends were also concidered his family. Narciso Rodriguez had a wonderful @CAPS2 to grow up in.",2,3,,3,,,,,,,,,,,,,,,,,,,,
3535,2,"Censorship in libraries is an inportant thing in schools and in the public. It is inportant beause some of movies, books, and magizines have a bigger influince on the kids then most people think. Like some of the really gory movies the are always people in the movie gettin cut up or shoot. Do you really think that some kids dont think about hat stuff. Somtimes the kids can get it in there head that they can do what they see or read.     Like in the movie @LOCATION1 @CAPS1 they are beating up and killing people just because they are colored. And some kids @MONTH1 think that that is ok. And they can go down to there librarie and just get it off the shelf and check it out and go home and watch it. Now if you r using it as a thing to teach kid that it was the way things use to be and that it is wrong then that is ok. You can teach your kids all you want just make sure that it is the wright thing.     And some magazines that are in the schools or in the public librarie are just not the kind of thing that kids should not be looking at. Like the gun magazines or the hunting magazines the just show that it is ok to carie a gun were ever they go. And the hunting magazines just show that you can go out and shoot stuff. And some kids @MONTH1 be confused that you need a lisense to do all of that. You have to at least put and age limmiet of some stuff.     Go's the sameway with some of the books they always start out good and then the just turn into a big mess of gor and vileance. Like the spere it started out with a group of people going under water to explore a ship. And they find a big shpere and they go in it and get these powers and they imagin it and it comes true. Well when a kid reads that they @MONTH1 think that they can do that and they start imaging that they can eather hurt or really do some damage to someone. And then when they find out that it wont work they @MONTH1 do it to them themselves.     So it just come to show that you should censor some of the stuff that you have in your libraries and if you can take them out then at least put and age limite on them",3,3,,3,3.0,3.0,,,,,,,,,,,,,,,,,,
559,1,"Dear Local newspaper, @CAPS1 a world filled with gargantuan people seated at a moniter, their eyes staring at it blankly. Outside the city streets are deserted, save for the squirils running along fence posts. This is what will happen if people spend to much time on the computers. People will spend less time exercising, less time outdoors enjoying nature, and less time interacting with family and friends. This is why computers have a drastic negative affect on people. First of all, people send huge amounts of time on their computers and small amounts of time exercising. In a recent poll done by @ORGANIZATION3 magazine, it stated that @PERCENT1 of people between the ages of @NUM1 and @NUM2 prefer to be online rather than outside exercising. That article also states that since @DATE3, child obesity has increased by @PERCENT2! @PERSON2 of @ORGANIZATION1 at @ORGANIZATION4 states that “ the reason child obesity has increased so much is because children spend so much time in front of the computer and less time outdoors. Do you want this rate to increase in the next ten years? Secondly, spending so much time inside decreases the time you spend outside enjoying nature. Bird watches monthly has had a decrease in subscriptions the @DATE1 because people are not interested in nature anymore. In a study done by @PERSON1 and his collegues at @ORGANIZATION2, @CAPS2 of @CAPS3 spend almost @PERCENT3 more time indoors infront of electronic devices, most frequently computers, then they do out doors. @PERSON3 says, “@CAPS4 to the new advancements in technology, people are to spend more time indoors than outdoors and that percentage will most likely increase as the decade proceeds”. Finally, spending so much time in front of the computer leaves you less time to interact with family and friends. In @DATE4 more than @PERCENT4 of family ate dinner together now, only @PERCENT5 eat together usually because they are in separate rooms in front of a moniter. This also leads to higher crime rate, believe it or not. Because young children and adolescents don’t have the person to support and guide them because they don’t spend time together @CAPS4 to the frequent use of computers, there is a @PERCENT6 chance that child will commit a crime compared to the @PERCENT7 chance a child would in @DATE5. Do you want that for our youth? Now @CAPS1 a world where people jog together in the park, as they jog, they see a group of bird watchers huddled together under a tree. As the joggers proceed, they come to a pavilion and see a big family celebrating the @DATE2 of a family member. This happy thought won’t become a reality if people spend too much time on their computers and less time exercising ,enjoying nature, and less time interacting with family and friends. So, local newspaper I encourage you, to encourage others, to get outside and spend less time infront of the computer. You have the power to make a difference in your real lives. But the question is, will you?",6,6,,12,,,,,,,,,,,,,,,,,,,,
15532,6,"Some problems the designers faced, were the violent air currents that form in urban areas, this would be a problem because the dirigible would be tossed around due to it's light weight. Another problem, is the fact that it would be too dangerous to land a dirigible over a densely populated area like New York City.",1,1,,1,,,,,,,,,,,,,,,,,,,,
18844,7,There was a day when I was patient and I was so nice and this girls was so in aher she was getting on my nrvise because she push me and hitting me. So I just let her in front of me and we where in @CAPS1 and lot of people be ready for @CAPS1 lady said stop push her. Then we where in class and so I rise my hand and she said be patient I said I am patient so shut up so shut up please so she don’t shut up so I my had a other time and the teacher call on me so she got mad at me.,4,6,,10,,,1.0,1.0,1.0,1.0,,,2.0,2.0,1.0,1.0,,,,,,,,
6157,3,"The settings have a huge affect on the cyclist. When he first comes to the ‘@CAPS1 town” he isn’t really warried he is kind of laughing and thinks his funny by saying.” This place might have been a thriving little spot at one time  - say, before the last world war.” Then after he says that it ways he chuckled. When he gets the dark in the road with the risky pipe of water he begins to switch into conservation made and begins to get is scared. He says.” I would comer  water- a test at my inner spirit “ This showing that he was scared. After he sees the abanoned Grape juice factory he says something like birds are going to pick him clean and leave behind same expensive biking gear. This definatly shows that he is giving up. Another thing that would back this up is when he talks about writing in his diary about the old men who gives him these direction. When he finally reaches the balt shop he is releved and goes to the bathrom and drinks water. He  also says that he will buy bait even though he doesn’t have a rod. These examples show the many ways the setting affected the cyclist.",3,2,,3,,,,,,,,,,,,,,,,,,,,
519,1,"Dear Readers, Computers have a large presence in the world today. Most people in the @LOCATION1 have at least one and the number grows still. These computers are bad for people. They cost a lot of money cause people to stop exercising and become unhealthy, and teach children that things come easy in life. Computers cost a lot of money. Between buying one, purchasing hardware and protection, and paying for maintanence, they are very expensive. Dr. @PERSON2, a computer science expert, claims, ""The average computer costs @MONEY1. There is then hardware that needs to be bought and replaced, along with antivirus programs and other protection. Now we could be talking about @MONEY2 at the very least. With yearly maintanence costing about @MONEY3 per year, you can see how expensive these machines really are."" @CAPS1 out of every ten computer owners in a recent survey stated that they had to service their computers within the last three months. Thats a lot of many going toward fixing computers. But computers don't just cause money problems, there are health issues too. Computers take a lot of time away from people. When a computer is used, the user doesn't move around or exercise. Computers are making people unhealthy. The obesity number in the @LOCATION1 has skyrocketed, but it's not just food, Some experts are now contributing computer use to lack of exercise, and therefore, obesity. Dr. @DR1 @CAPS2 says, ""@CAPS3 matter what you're doing on a computer, be it games or education, you would be better off outside, moving around, getting exercise. A recent study shows that @NUM1 out of @NUM2 families who purchased a computer in the last year have halved their exercise and play time. There are health problems created by computers, but they also teach the next generation that things come very easily. Computers are an excellent source of knowledge, but that could be a problem. It is a quite easy to find something out, or research a topic using a computer. Before computers became popular, people had to work and look for @CAPS4. Now that it is so easy, children @MONTH1 begin to think things come easily in life. @PERSON1, a pediatric psycologist, says, ""The mind of a child works in a such a way, that most things they encounter are absorted and become normal. If a child becomes use to the ease of searching an item on a computer, he will expect all things to be equally simple. If they are not he @MONTH1 become frustated and not be able to do what is needed."" @NUM3 out of @NUM4 poll takers agree that finding @CAPS4 on the computer is quite easy. What are the children of the world being taught? Life is easy, a false statement. Computer use is a growing problem. It costs ridiculous amounts of money, causes health problmes, and poisons the minds of children to believe that life is an easy thing. Computers are bad for the people of the world, they take our money, our health and the minds of our children.",6,6,,12,,,,,,,,,,,,,,,,,,,,
12484,5,"Your home @CAPS4 were you find happyness, joy and peace. Not only is home a @CAPS1 to be @CAPS2 but a @CAPS1 for family to be unified. In this @CAPS3, The author explains what it is to have a family and what it is and means. Joy and peace is the over all mode and thats what family @CAPS4 feel likeMany farmles in @LOCATION1 are immagrants and thats what makes up @LOCATION1. Many people stuggle to give education and happiness to there familys. They care about there familys future and would leave there hole life back in there home countries to give that to there Children and that is what familes @CAPS4 do.The author is great ful for what his parents have suffered so that he could get the good education here and not suffer as they did The mood is very calming and it describes what home and family @CAPS4 feel like.",1,2,,2,,,,,,,,,,,,,,,,,,,,
1322,1,"Dear local newspaper, @CAPS1 do you feel about the advantages and disadvantages of owning a computer? I think that computer help in many different ways. Computers teach hand-eye cordination, helps us learn, and we can even talk online with friends and family. Do you ever think about @CAPS1 you computer can help you phisicly? Many parents state that, ""@CAPS2 spend to much time on the computer!"" but what they don't know is that the computer is teaching them hand-eye cordination. Parents argue that kids wagh more because they sit inside on the computer, but if they do sertain things to limit the @CAPS2 like only goind on sertain games, limiting there time on the computer, or making them play outside the same amount of time they were on the computer the kids could be learning while still staying fit. This is why a computer could be a way important part of a childs life if used properly. What is you method of learning? Maybe you read books, go to school or even watch @CAPS3. But what if you arn't at school, or have any books around? What if your @CAPS3 isn't telling you what yo need to know? Well, with a computer you can look up almost anything with just few clicks of a button. If you don't have time to take a trip to you local library to a book, @CAPS1 would you learn? As teen who attends school I know that I would not be able to do a lot of my school work and projects without my computer. A lot of the at home jobs today require computers, and without the computers the job would not be getting done. This is why I think computers benifit our society and knowledge. Does everyone you know live in one are? Probably not this is why websites like @CAPS5 and @CAPS6 are getting more and more members each day. Ther internet helps us keep intuch with relatives friends and ever helps us meet new people. I know that the internet helps me heep in tuch with old friends.",5,4,,9,,,,,,,,,,,,,,,,,,,,
20833,8," Laughter is a great thing, except for some instances. We all have been there. Having a good time with friends, laughing and making new memories. Then you take a drink of something and start laughing again. Next thing you know you're choking and can't breathe. You're coughing as much as you can, trying to stop. It's not only a little embarrassing, but it can get a little awkward too. You can't stop it, you just have to let nature take its course. Everyone stares, asking if you're alright. The moment feels like forever, and that was exactly how I felt. I have two best friends, @CAPS1 and @PERSON1. It was during the @DATE1 and we decided to have ourselves a little movie night at @ORGANIZATION3's house. We were fully prepared with candy, soda pops, and the best of all, pizza. It all added up for a great night. We decided to watch the movie @ORGANIZATION1. It's all of our favorites, I don't think we could ever grow tired of it. @CAPS1, @PERSON1 and I found comfortable seating arrangements and started to watch the movie. We were eating, laughing hard-core and making comments along with it. We were having a great time. Then I decided to take a drink of my @ORGANIZATION2. I was about to swallow it, but just my luck, one of the funniest parts in the movie was on. I started to laugh and knew I had an issue. I put my cup on the table, quickly got off the couch, and took two steps when most of the @LOCATION1 in my mouth came flying out onto the floor. I couldn't breathe and was now coughing, so I kept running to my destination, the kitchen sink. I was about two feet away from the sink, I was so close! Then I felt something come up my mouth that I couldn't control. I wasn't going to open my mouth, it'd be all over the floor! I was so grossed out I basically threw myself at the sink. My mouth opened and there went the puke, into the sink. I continued to cough, wondering when it would it would all end. ""@CAPS2 you okay?!"" @CAPS1 ran into the kitchen and started hitting my upper back, trying to help me out. @CAPS5 hit me three times, then I could finally breathe again. ""@CAPS4 you, I was having a hard time."" @CAPS5 started laughing, while I was still disgusted with the nasty taste left in my mouth. I put my head under the faucet trying to clear it out a little. I grabbed a towel, and we made our way to the living room. We entered the room to find @PERSON1 sitting on the couch, laughing hysterically. @CAPS1 sat by her, and started to giggle a little along with her. I got on my knees and started wiping up the @ORGANIZATION2 spill on the floor. There wasn't too much, but still a good amount. I started to chuckle a little to myself while cleaning it up. I thought to myself, ""@CAPS6 must I always be the one to choke?"" ""@CAPS6 didn't you just go to the bathroom sink? I mean it's right there!"" @PERSON1 was pointing to the door and still laughing. ""I didn't think of that! I just ran for the kitchen!"" I've been to her house plenty of times before, but the bathroom slipped my mind. I laughed at how much of a blond moment I had just had. ""@CAPS8 my gosh,"" @CAPS5 laughed a little then continued, ""@CAPS9 me of @CAPS10! When I saved you!"" ""@CAPS11 up and watch the movie!"" I told her jokingly. @CAPS5 finished laughing and we were enjoying the movie in peace again. They both still tease me about that, but I don't mind. It just goes to show you the things laughter can unexpectedly bring.",20,20,,40,,,4.0,4.0,4.0,4.0,4.0,4.0,4.0,4.0,4.0,4.0,4.0,4.0,,,,,,
13368,5,"The mood in this memoir is happyness, love, and warmth. It is to be thankful for what you have and not what you want to have. Narciso was just happy to have such a loving family. Inside of Narciso's home it is very happy loving and warm. I think that the author is trying to make it seem like nothing matters as long as you have family. Overall the mood created by the author in the story is love.",1,2,,2,,,,,,,,,,,,,,,,,,,,
16067,6,"When constructing the mooring mast on top of the empire state building it seemed as if the engineers looked past all of its flaws. Safety was probaly one of the biggest issue for the mooring mast. It was said most dirigibles outside the United States used hydrogen of helium. Thus causing a higher risk to explode. After the events of the Hindenburg in Lakehurst, New Jersey, they were very afraid what would happen if it occured above downtown Nature was belived to be its biggest obstacle. Winds at the top of the air awalys shifted violently due to air currents. The back of the ships would swivel around and around the mooring mast @CAPS1 were another major reason. Dirigibles were not allowed to fly a certain height over Urban areas. Making it illegal to even approach the area where the building was. Al Smith really should have done some more studying about what could have gone wrong with his mooring mast.",3,3,,3,,,,,,,,,,,,,,,,,,,,
12345,5,The author is telling us a story about a kid that Just came to the United States. He is only @NUM1 years old & he likes it. A man named narciso @PERSON1 is a memoir to all the people.,0,0,,0,,,,,,,,,,,,,,,,,,,,
1593,1,"As the people of the world are starting to use the computer more and more, I think it has a extremely positive effect on people. Computers are not all fun and games they help with other things as well. For example, some of the amazing things the computer are; teach hand-eye coordination. give people all over the world a chance to learn about the places, people and culture from far away places, and last hit not least, it is another way to allow people to talk online with their friends. Now let me explaine more about what a positve effect the computer is for the millions of people that use one. The computer today is such a great thing to have in your house. It is not for just ga off and playing video games on, it is also very helpful in the education of young children, teens, parents, and even grandparents. when you use the computer there os so much you can learn. For instance lets say you have a in your socical or history about the country or and you don't know a thing about it. What do you do? You should log onto you computer find a reliable website and boom you are learning facts about @LOCATION1 that you would have never know until you logged onto the computer. The computer is also a great way to practice and get better using your hand-eye coordination. First you need to learn about the of the keys and where they are positioned on the keyboard. After you have that skills, you should try to look at the computer screan. and not be working down at you finger keys. Not only is that not helping you hand-eye coordination, but it is causing you to type much slower than you would if you were looking at the screen. The computer truely is unbelievable. Are you one of those people who's parents don't you get a phone because use of how much it costs without even the cost of texting? Well if you are, the computer help you out with that problem aswell!! There are bunches of different ways to talk to your friends and family on the computer. For example, you could use @CAPS1 to instant your friends or facebook to learn more and more about somebody. The comp. is so hanndy! So lets recap on what we learned! The computer helps people learn about different places all over the world helps w/ hand-eye coordination, and lets you talk to your friends! I think the comp is a in every household.",5,5,,10,,,,,,,,,,,,,,,,,,,,
6037,3,"Heat, dry, flat - all are features of the setting that effected the cyclist. As the cyclist was driving through the desert, he noticed how hot it was, and how he would become dehydrated quickley. I was also very dry and and he started to get nervous about how thirsty he was. The flat ground models how there is nothing around that can help the cyclist, which made him scared. The story also metions that he is a ghost town",2,2,,2,,,,,,,,,,,,,,,,,,,,
15994,6,"The builders of the Empire State Building faced a lot of obstacles in trying to dock dirigibles there, but they had to figure a way around. The architects believed that the mooring mast would work and they started building. Soon enough, problems evolved that could not be fixed. An example of one of their problems is that dirigibles use more hydrogen than helium, which makes it very flammable. If the dirigible had an accident over New York many people would be hurt. Another factor that goes with this is the wind currents. The wind is too strong that the dirigible would be swirling around even if it was tied up. However, they could use lead weights to keep it still but if they fell it would hurt some pedestrians walking by. Furthermore, the state law made it illegal for airships to fly too low which made it impossible for dirigibles to be tied to the mooring mast on the Empire State Building. After all these problems, the architects never added the landing gear to the mooring mast because they knew that it would not be used as it was intended to.",3,3,,3,,,,,,,,,,,,,,,,,,,,
7318,3,"The features in the setting affect cyclist in many ways. One of which is bring only to carry so much equipment which @MONTH1 be needed. For example, you can only take so much water with you and once you run out of there are no buildings or anything around that you are out of luck. Also, you can only take so much food. Finally, when you are ready to go to sleep you can’t just pull over you have to ride until you find a hotel or get home. I know that I would not make it. So those are just a few reasons on why the setting affects cyclist.",1,1,,1,,,,,,,,,,,,,,,,,,,,
