essay_id,essay_set,essay,rater1_domain1,rater2_domain1,rater3_domain1,domain1_score,rater1_domain2,domain2_score,rater1_trait1,rater1_trait2,rater1_trait3,rater1_trait4,rater1_trait5,rater1_trait6,rater2_trait1,rater2_trait2,rater2_trait3,rater2_trait4,rater2_trait5,rater2_trait6,rater3_trait1,rater3_trait2,rater3_trait3,rater3_trait4,rater3_trait5,rater3_trait6,comments
250,1,"I do not believe computers benefit society. Many people spend their life on their computer instead of exercising, going out with friends, or spending time with family. @NUM1? Of @CAPS1 will agree they spend at least @NUM2 hours a day on their computer. Which is unneccessary. Why is there so much obesity in the world nowadays? Because of a lack of @CAPS3. And who is the #@NUM3 cul? Computers of course. In order for more people to maintain healthy, there needs to be a lot of @CAPS3. When someone can sit around all day clicking a mouse or typing keys in, how much @CAPS3 are they really getting? Plus, there are many different disorders in the world. @PERCENT1 inf will agree that with more @CAPS3, these sometimes painful disorders could be avoided. Too many people are choosing their computer overexercise and it them many health problems that could've easily been avoided. Secondly, everyone would agree that friends are essential in life. But now people are talknig to their friends online or in computer games instead of going to the them. Online there is much more which often break up friendship. Also, online you new people or make as many new friends. @CAPS2 you go and have many more friends, which makes life in general much better. Finally, you wouldn't wants families become would you? Well, this is one of the many effects the @CAPS2 members of a family get together which could weaken them as a family. Plus, husbands and wives could not talk very often, often leading in separation or devorce. This could make a child have in decide between a whole family to @CAPS3, friends, and family are essential in life, and computers put those in jeopardy. So take a stand and end this reign for good, stop the use of computers before it is too late.",5,5,,10,,,,,,,,,,,,,,,,,,,,,"ID1,ORG1,STY3"
15110,6,"There are always challenges when you are trying something inovative. There are obstacles like getting approval, gaining support and you also need to be structurally sound. Al Smith and the rest of these archetects faced all of these. During the 1920s dirigibles were supposed to be the future of travel. Al Smith wanted to be able to dock a dirigible on top of the Empire State building. Other than getting people to go along with the plan he had other problems. The wind is very violent at that altitude. Dirigibles were not supposed to fly that close to the city it is dangerous and some were highly flamable. In conclusion There were too many large obstacles to overcome.",2,2,,2,,,,,,,,,,,,,,,,,,,,,"ID2,ORG1,STY1"
16066,6,"The task of allowing dirigibles to dock on The Empire State Building was met with many obstacles. The fist one to come into play was the support of the building. The dirigible's load and the wind pressure would greatly reduse the stability of the building. Over sixty thousand dollars' went into modifications of the building's framework.Another problem was the dirigibles themselfs. Most dirigibles coming from outside of the United States were filled with hydrogen. As seen in the tragic Hindenburg inncodent, hydrogen is highly flammable. The owners of the Empire State Building concluded that an accadent such as this would be even more devastaing over a densly populated area. After being faced with all these obstacles, the idea of dirigibles docking atop the Empire State Building was put to rest for the safety of the people.",2,3,,3,,,,,,,,,,,,,,,,,,,,,"ID2,ORG1,STY1"
9285,4,"The author chooses to end the story with this paragraph to get across the theme of acceptance and determination. Saeng is very attached to the hibiscus plant because for her it represents her homeland and all the things she left behind. This last line represents many things. The snow melting, the geese returning, and the hibiscus budding all indicate a time of rebirth and new beginnings. The fact the Saeng wants to retake her test shows how obstacles can be overcome, and goals achieved",2,2,,2,,,,,,,,,,,,,,,,,,,,,"ID2,ORG1,STY1"
18497,7,"@PERSON2, get down here I need you to open an evelope! My mom said. We spanted down stairs because an envelopes can only mean, a report card, letter, @CAPS1 card, or checking account balance.  We got downstairs and we saw they had a camera out, and the envelope had a starrer on the back that said @NUM1 radio. We open @CAPS6 and @CAPS6 says congroduclotions you won tickets to @NUM2 first @CAPS2 @CAPS3 with @PERSON1! I was just looking at them in awe, my sister was freaking out! Then, my mom told me that my aunt is going with us! Surprise just kept coming and coming. Another huge surprise was the lines about @NUM3 girls were lined up at the front doors of the @CAPS4 oak music @PERSON3. Then security started to move and spread all the girls out, we got pushed about a quarter mile away from where we were standing. @NUM4 Â½ hours later we were waiting then I see this boys head pop out a window of the music @PERSON3 and say,"" @CAPS5 girls!. After he said that about @NUM5 girls went crazy screaming. @NUM6 Â½ hours later from that, they started to let people in. The theater was cozy and warm for being out in the cold for @NUM7 hours @CAPS6 felt good. Iyaz Was the special guest to get us warmed up for @PERSON1. When he got out every girl was screaming their lung out! He sang the concert and @CAPS6 was a great experience for my first concert ever!""",12,6,,18,,,3.0,3.0,3.0,3.0,,,2.0,1.0,1.0,2.0,,,,,,,,,"ID3,ORG1,STY3"
1,1,"Dear local newspaper, I think effects computers have on people are great learning skills/affects because they give us time to chat with friends/new people, helps us learn about the globe(astronomy) and keeps us out of troble! Thing about! Dont you think so? How would you feel if your teenager is always on the phone with friends! Do you ever time to chat with your friends or buisness partner about things. Well now - there's a new way to chat the computer, theirs plenty of sites on the internet to do so: @ORGANIZATION1, @ORGANIZATION2, @CAPS1, facebook, myspace ect. Just think now while your setting up meeting with your boss on the computer, your teenager is having fun on the phone not rushing to get off cause you want to use it. How did you learn about other countrys/states outside of yours? Well I have by computer/internet, it's a new way to learn about what going on in our time! You might think your child spends a lot of time on the computer, but ask them so question about the economy, sea floor spreading or even about the @DATE1's you'll be surprise at how much he/she knows. Believe it or not the computer is much interesting then in class all day reading out of books. If your child is home on your computer or at a local library, it's better than being out with friends being fresh, or being perpressured to doing something they know isnt right. You might not know where your child is, @CAPS2 forbidde in a hospital bed because of a drive-by. Rather than your child on the computer learning, chatting or just playing games, safe and sound in your home or community place. Now I hope you have reached a point to understand and agree with me, because computers can have great effects on you or child because it gives us time to chat with friends/new people, helps us learn about the globe and believe or not keeps us out of troble. Thank you for listening.",4,4,,8,,,,,,,,,,,,,,,,,,,,,"ID1,ORG1,STY3"
15088,6,"In the passage ""The Mooring Mast"" by Marcia Amidon Lüsted, the obstacles builders of the Empire State Building faced in attempting to allow dirigibles to dock there are brought out. The author brings our ""The greatest obstacle to the successful use of the mooring mast was nature itself"". The climate and winds were constantly changing at the height of the building. The back of the dirigibles would then swivel which could very well be dangerous. Also the builders had to take into account the fact ""most dirigibles... used hydrogen rather than helium, & hydrogen is highly flammable."" The Empire State Building is in the middle of New York, a highly populated State. The explosion of a dirigible at the top of the Building would be very dangerous & would lose a lot of lives. The builders of the Empire State Building under went many challenges in trying to allow Dirigibles to dock.",3,3,,3,,,,,,,,,,,,,,,,,,,,,"ID1,ORG1,STY1"
20921,8," Being with family and friends during a memorable trip always seems to spark a smile. There are always times to look back on; whether they are fond memories, or thoughts of nostalgia. I was about to graduate, and my parents had just broke the news to me that we were going on a trip to @LOCATION1 after the year was finished. We had the date set; @DATE1, right after school was over. The first reaction out of my mouth was filled with entreatment, wishing for my best friend to join us on this trip. My parents took the time and thoughtfully considered all the advantages and disadvantages, and rapidly responded in the affirmative. I was thrilled to know that the memories I was about to create with my closest family members were now to include my best friend.  First thing was first, I had to get down to business. I needed to call my friend, @PERSON1, and ask her if she'd like to come along. Selfishly assuming that her immediate response would be an exuberant ""@CAPS1!,"" I was @CAPS4 first devastated when she postponed her response and didn'@CAPS6 seem too excited. I didn'@CAPS6 consider the fact that there @MONTH1 have been some sort of miscommunication. She talked it over with her mother, and gave me a call back. I had made the mistake of not telling her that we would have her financially covered for airfare, dining, and hotel rooms. We cleared everything up, and they decided she @CAPS3 join us. The two of us together couldn'@CAPS6 have been more ecstatic if we tried! @PERSON1 and I made a countdown board that started around two months from our departure date. There were many factors that we would take into hand while planning. As we measured out exactly how much time we had, we also planned which landmarks, resorts, and shops we would visit. Our family friend lived in @LOCATION1 @CAPS4 the time, so she gave us a tour of the island. Having such a close acquaintance to guide us made the trip even more fun. She knew all the local hangout spots, and had access to the military beaches because she works in @ORGANIZATION1!  Many humorous occurrences happened often while we were on that vacation, but some of the most memorable moments happened in the hotel while I was with @PERSON1 and my mother. My mom has always had a way to make every situation hilarious, so it was a blast when we went out on a girls night. First, and most significant of our adventures, we went shopping in the mall that was attached to our hotel. There was an abundance of varied small clothing stores, food shops, and jewelry outlets. One of our favorite stores that we visited was a @CAPS6-shirt shop with chocolate infused fabrics! We spent so much time looking @CAPS4 all of the designs, that I think we ended up carrying a wave of cocoa with us for the rest of the night.  As soon as we finished our shopping quest in the town center, we worked our way back up to the room, laughing and involved in pointless girl talk. The three of us girls shuffled with smiles, sore feet, and new bags onto the elegant, ornately designed golden elevator. My mother pushed the button to take us to our floor, while @PERSON1 carried on a story about plans we had the night before. Absorbed in conversation, we hauled our new things down the long hallway to our room. Realizing that we didn'@CAPS6 have a key card to open our room's door, the three of us decided that we should just knock on the door and my father would answer. ""@CAPS2 was supposed to be back from renting our surf boards by now, so why isn'@CAPS6 @CAPS2 answering?"" we thought, ""@CAPS3 @CAPS2 still be out on the beach?"" @CAPS4 this point our conversation died down a bit as we tried to figure out what to do. I sent a message to my dad's cell phone, and @CAPS2 said @CAPS2 was in the room. We ended up pounding on the door for a good five minutes, assuming @CAPS2 was playing a joke on us by not answering. After waiting a few moments in confused silence, I began to notice a low buzzing voice coming from inside the room. I turned to my mother and best friend, and @CAPS3 barely keep from laughing. It was then that it hit me, and I said to both of them, ""@CAPS5 guys! We didn'@CAPS6 leave a @CAPS6.V. on!"" We immediately halted our intrusion, moved as quickly as we @CAPS3 away from the door, and continued to howl with laughter. My mother had hit the wrong floor button on the elevator! We were so absorbed in having a good time that we didn'@CAPS6 even realize we were bothering someone, and embarassing ourselves! It wasn'@CAPS6 just one moment or one trip, it is now a lifetime of joy because I can look back on those memories and smile @CAPS4 them. It's these moments that I treasure the most.",23,20,,43,,,4.0,4.0,5.0,5.0,5.0,5.0,4.0,4.0,4.0,4.0,4.0,4.0,,,,,,,"ID1,ORG1,STY1"
13077,5,"The @CAPS1 of the @CAPS2 was happiness and out going, nice @CAPS3 told it good @CAPS3 felt happiness Solidarity.",1,1,,1,,,,,,,,,,,,,,,,,,,,,"ID3,ORG1,STY1"
15215,6,"During the construction of the dirigible dock at the Empire State Building, architects and builders were faced with many obstacles. Before the mooring mast was installed at the top of the building, it became evident that ""the stress of the dirigible's load... would have been transmitted all the way to the building's foundation"" (paragraph @NUM1). This meant that changes would need to be made in the framework in order to support the weight. In addition, safety, weather, and legal issues were at hand. Filled with flamable gas, there was always a risk of a dirigible catching fire, and in an urban area the damage would be extremely bad. Winds at the top of the building were also dangerous. Air currents were ""violent"" and ""even if the dirigible were tethered to the mooring mast, the back of the ship would swivel around"" (paragraph @NUM2). Normally, the ships would be weighted down, but, again, this was not possible in a city. The last issue builders faced was the law ""against airships flying too low over urban areas"" (paragraph @NUM3). Although there was a law clearly against it, two dirigibles attempted to dock. Both attempts were failures and it became clear that the Empire State Building would not be able to serve as a dirigible landing.",3,4,,4,,,,,,,,,,,,,,,,,,,,,"ID1,ORG1,STY1"
15420,6,"The obstacles of the builders of the Empire State Building faced were hard because they couldn't just drop a mooring mast on top of the Empire State Building do to the frame work Also the stress of the dirigible's load and the wind pressure would have to be transmitted all the way to the building's foundation. Which was nearly eleven hundred feet below. The steel frame of the Empire State Building would also have to be modified and strengthened to accommodate this new situation. And over sixty thousand dollars' worth of modifications have to be made to the building's framework The architects designed a shiny glass and chrome-nickel stainless steel tower that would be illuminated from sides, with a steps-back design that imitated over all shape of the building itself capital rocket-shape mast would have four wings at its corners, of shiny-aluminum, and would rise to a conical roof that would house the mooring arm.",1,2,,2,,,,,,,,,,,,,,,,,,,,,"ID2,ORG1,STY3"
9909,4,"It shows not to give up, it ends almost  the same way it began, it shows that people should not stay too attached to the past each are reasons why I believe the author concludes the story with that paragraph. It shows that people should not give up because even though she failed her test then she will try again later to pass it. Also the story ends the same way it begins by her taking the test or getting ready to which is a good way of writing. One last thing is that it shows that people shouldn’t become too attached to the past because if they look at one thing that reminds them of it they @MONTH1 fall apart, that is why she takes the test, to see if she can look at the familiar flowers without falling apart.   ",2,2,,2,,,,,,,,,,,,,,,,,,,,,"ID2,ORG1,STY2"
13363,5,"I think the mood of the memoir is comforting and happy because it talks about how a simple house became a home. The memoir shows how a family can turn a random house into a home would love and by selflessly letting people stay with them until they can get back on their feet. The memoir also shows how family has nothing to do with being blood relaited, it's about being their for one another in a time of need. I think that shows a great amount of comfort and happiness, knowing that a simple apartment could become a loveing home, filled with family and love.",2,2,,2,,,,,,,,,,,,,,,,,,,,,"ID2,ORG1,STY2"
3647,2,"There are many books, music, movies, and magazines that people find offensive. Some people even believe these things should be taken off the shelves. I do not believe that the books, music, movies, or magazines should be taken off the shelves completely. Not everyone finds these things offensive and they should not be taken off the shelves because a few people do not agree with them.     First, people have different views on what they find offensive. Not everyone will find the same things offensive or want the same books or song to be removed. With people always having different views it is difficult to take books, music, movies, or magazines off the shelves for everyone. Just because one person does not agree with what is being said in the movie or book does not mean that every single person wants that movie or book to be removed. If one person found my favorite book offensive I would not want it taken off the shelves completely.      Equally important, if every book, song, movie, and magazine that someone finds offensive is taken off the shelve there would not be many books, movies, songs, or magazines left. Author Katherine Paterson once said, 'But if I have the right to remove a book from the shelf-that work I abhor-then you also have exactly the same right and so does everyone else. And then we have no books left on the shelf for any of us.' @CAPS1 is saying that if every single book that offends someone is taken off the shelves there would be no books for anyone to read. People find different things offensive and if everyone took these things off the shelves there would be none left for anyone.      Finally, if someone finds a book offensive they do not have to read it. When someone finds a book, movie, song, or magazine offensive they don't need to watch it or read it. Instead of taking it off the shelves the person could just not read it. Not everyone finds the same books offensive and taking them off the shelves could upset many people. When someone finds something offensive they could just avoid that instead of getting it removed and upsetting other people. If someone was offened by one of my favorite books, I would prefere if they just avoid reading it instead if taking it off the shelves so that I can not read it.      Some people find many books, songs, movies, and magazines offensive. They would like these things to be removed from the shelves permenatly. I, however, do not believe that these things should be removed. Taking these off the shelves could make some people happy, it could also upset even more. Not everyone finds the same things offensive and should not be taken off the shelves because a few people do not agree with them",4,4,,4,4.0,4.0,,,,,,,,,,,,,,,,,,,"ID1,ORG1,STY1"
7605,3,The features of the setting like the dessert the sun and abondered towns affect the cyclist alot. The dry dessert makes him feel as if he were riding forever. And probably makes him wonder if he is ever going to make it to a town. The sun makes hime even  hoter not  he already is makes him sweat more and makes him even more thirsty.The abandoned towns make him lose hope in finding water or even if he is ever doing to make to yosomite. The mood of this story goes from content to sad to happy. He is content after riding to the first town but then the rest of time towns are abandoned too and start to ran out of water an he thinks he is going to die which makes it sad. Then he becomes happy when he finds the bait shop an finds water.,2,3,,3,,,,,,,,,,,,,,,,,,,,,"ID1,ORG1,STY3"
1049,1,"Dear edditer of my local newspaper In my opinion computers have a positive effect on people. I support the advances in technology. I believe @CAPS1 is a positive thing because @CAPS1 teaches hand-eye coordination, gives people the ability to learn about far away places and people, and even allows us to talk online with others. In the following poragraphs I will share with you my opinions and why they are the right opinions for all to believe in. Firstly hand-eye coordination plays a big part in our lives, many of us do sports. Now sports isn't just about being the best @CAPS1's about getting better and doing your best. Sports take alot of practice, and are way is computer games though I bet you didn't know @CAPS1, these games help you develope hand-eye coordination. Defeating these monsters and such really helps you in sports. Catching and throwing is a big part in alot of sports and thats all hand-eye coordination, and where do you think you get @CAPS1 from practice and computer games. So next time your on the computer play som games and that will be like practicing for sports and will help you devolop the hand-eye coordination you need to suceed in a sport. Secondly, @CAPS2 in favor for computer use is because @CAPS1 gives us the oppurtunity to learn about places and people from all around the world. Think about @CAPS1 before computers if you want to know something you might have to locate all around for a book that tells you @CAPS1, @CAPS1 could take, now you type what you want to know or google and bing theres your answer. This ability to quickly find what your looking for allows you more freedom to learn and spend other precious time doing other things you want to do then take the to locate and read the right book. As you can see this is a ability and can be a big help when you need to know something fast. So help you yourself and use computers make life easyer. Thirdly computers are a way to communicate they can let you talk to people all around the, when you might and usaly be able do. This is a great way to stay in contact wen people move, go away on a buisness trip go on vacation, or even to meet new people. Say you cany get a hold of someone because there phone is off and its important you talk to them you could email them or if there online and ahave @CAPS3.M. you could @CAPS2(instant message) them. This would save you the hessle of having to keep calling him. Also if you want to see what there doing or where they are you could us a webcome and see them instead of just talking to them. As this paragraph shows internet and computers open more then ever before. As the I wrote above, I showed not even a fraction of what computers are good for. My reasons for computers being more of positive thing, ever a negitive thing are as followed; they help us with learning things that before we couldn't, communicate with others, and help us develope hand eye coordination. I can only hope that as I write my conclusion, ""that my opinions were heard and that this letter has helped all see why computers are a great thing, not a bad one.",5,5,,10,,,,,,,,,,,,,,,,,,,,,"ID1,ORG1,STY3"
12273,5,"The mood in the memoir was created in a couple of different ways by the author. One of the moods that was created in the memoir was happiness. Back in his past, his parents shared all of their Cuban family recipes, they had a lot of family and friend celebrations with the rest of the neighbor hood, sharing friendship and helping others in need @CAPS1 as long as you can sea, the family and the neighbors all came together as one big family to be happy, to make a happy community, and that made the memoir happy. Another mood that was created by the author was sadness. At the end of the memoir, the author went back to the present, talking about the past times. At the end, he thanks his parents for everything. He talks about how he came around to learned the definition of family and how he learned to love. Because of this, the old memories seem to get further away, and the mood changes to sadness. The memories are growing old, but he will always remember his ""family""and his name. The author did a great job at creating those two moods and putting them into his memoir.",3,4,,4,,,,,,,,,,,,,,,,,,,,,"ID2,ORG1,STY2"
