essay_id,essay_set,essay,rater1_domain1,rater2_domain1,rater3_domain1,domain1_score,rater1_domain2,domain2_score,rater1_trait1,rater1_trait2,rater1_trait3,rater1_trait4,rater1_trait5,rater1_trait6,rater2_trait1,rater2_trait2,rater2_trait3,rater2_trait4,rater2_trait5,rater2_trait6,rater3_trait1,rater3_trait2,rater3_trait3,rater3_trait4,rater3_trait5,rater3_trait6,comments
3769,2,"My views are that if it is offensive to someone or other people the certain maeterial shouldn't be taken off the shelf. I think you should have to have permission from a parent, or guardian if the material is explicit. For example in a store where you buy cd's, games ect... you have to be of age to buy the material that should be the same with books.          Say a book has a certain word on it like '@CAPS1' it shouldnt be taken off the shelf just because of its name. That brings up the subject don't judge a book by its cover. Just because the name isn't to someones standards it shouldn't matter. Pick the book up read the back and see what it's actualy about. Then if it's what you was exspecting it to be talk to someone who is in charge, and explain top them what the problem is in your case.     Also you could always have a section of the store, or librarie just for adults only. It @MONTH1 sound stupid, but it can actualy help out alot. There is tons of books out there that have things in them not appropriate for children. Such as love books, they talk about love, and passion in ways that are very innappropriate for children.      If there was a section of a store or librarie it could help keep these things out of your children, or other childrens minds. You or anyone else wouldnt have to worry about children picking certain material up that you wouldn't want them to see. Just keep this in mind next time your in a librarie and you see something you wouldn't like for your children to see",3,3,,3,4.0,4.0,,,,,,,,,,,,,,,,,,,"ID1,ORG2,STY1"
10470,4,"The reason why the author concludes the story with this paragraph is because the author feels that saeng will pass the test if she has the hibiscus with her, she thinks that because the hibiscus has something unique about it. And as also gives her memory of where she used to live before she had moved to the @ORGANIZATION1. Saeng had seemed out of place she did not know what to do.",1,1,,1,,,,,,,,,,,,,,,,,,,,,"ID2,ORG2,STY2"
7095,3,"The features of the setting affect the cyclist. One way is that the “rolling hills” @MONTH1 let the rider get more tired. Another way is that of water from severe heat. And finally the path you take along the way and how many stops you make along the way. The heat, lack of water, rolling hills, and the advice you get can result badly by affecting the outcome. A rider should make a plan and use determination to get to where they need to go.",2,2,,2,,,,,,,,,,,,,,,,,,,,,"ID2,ORG2,STY3"
15080,6,"There are many reasons Why the builder's faced many obstacles in attempting to allow dirigibles to dock there. In paragraph @NUM1 the excerpt states that most dirigibles from outside of the United states use hydrogen rather than helium, and hydrogen is highly flammable. The hydrogen can cause a fire and destroy the Empire State building and can destroy downtown New York. Another reason why the builder's faced obstacles in attempting to allow dirigibles to dock there is because it was against the law. In paragraph @NUM2 the exerpt states there was an existing law against airships flying too low over urban areas. This could be dangerous to the citizens of downtown New York.",3,2,,3,,,,,,,,,,,,,,,,,,,,,"ID2,ORG2,STY2"
10584,4,"Saeng concluded the story with that paragraph because it shows what she has just been through and feels she could go through it again. If she fails the driving test again, then she use the plants to overcome her problems. She @MONTH1 actually pass the test this time. The unique plants show that she is stronger than she thinks and believes now that she feels comfortable with the plants that bring back memories of her childhood.",1,1,,1,,,,,,,,,,,,,,,,,,,,,"ID1,ORG2,STY1"
12390,5,"Rodriguez creates a greatful and playful mood in this memoir. For example, in the second paragraph, Rodriguez writes about how his parents cooked, and the music they played In paranthesis, he adds his @CAPS1 about he was greatful for his parents love of cooking and how he still adores the passionate music his parents played. In paragraph @NUM1, the author writes about the closeness and kindness of his neighborhood. He talks about how everyone was an immigrant and faced segregation, but were always willing to lend a helping hand. Towards the end, in paragraph six Rodriguez is greatful to his parents for the love and sacrifices for him. In conclusion, Rodriguez adores the home his parents created for him.",2,2,,2,,,,,,,,,,,,,,,,,,,,,"ID1,ORG2,STY2"
3548,2,"Do I believe that vertain materials should be removed from the shelves of libraries if found offensive? I believe that all types of materials should be placed in libraries to satisfy the different styles of what people like. Censorship should not play a role because everyone has their own opinions on what is looked at as offensive and what is not. By giving everyone the freedom to enjoy what they like will make alot of people happier.      The wants and needs of people varie from one extreme to the other. What one person loves, another @MONTH1 hate. This should not play a role in whether or not materials should be removed from public places such as a library. Everyone has the right to express themselves through art in their own way. Taking away the art that some find offensive would not be fair to those who enjoy it. By doing this, not all people will be satisfied when not everyone gets what they want.     Censorship should not take part in any library. Entertainment can not always please everyone. It will be judged in many ways no matter what anyone has to say, so the problem should just be left alone. Arguing to take away the material that some like will only cause tension to rise and make matters worse. It is understandable, for example, that a parent would not want their child to be able to be welcomed into the media world where not everything has postive influences. That's life though and not everyone has th same outlook on it. You have to think of others, and respect their view of it all as well.     Opinons will vary with what I have had to say. I strongly believe that people should be given the right to enjoy the materials they take an interest in. Censorship definitely has its positives and negatives, but for the most part it is wrong and should not have a role in any library. Cutting down people's availability to their interests will only lead to frustration. You can not please everyone, so in that case, censorship will just have to be looked beyond.",3,3,,3,4.0,4.0,,,,,,,,,,,,,,,,,,,"ID2,ORG2,STY2"
7137,3,The settings of the story is very desert like what I mean by that is its the desert and its hot and he really had to push his self to make it. The condition at the rode are very rough and has a lotof shape turn it in. Apart in the story he gets a boost of energy and pedal as hard as he can down a hill and then relaxes. This is the setting and is summary of the story.,0,0,,0,,,,,,,,,,,,,,,,,,,,,"ID3,ORG2,STY3"
11893,5,"The mood of the memoir by @PERSON1 is love and compassion for his parents. He tells how he grew up with pride for Cuba and how he still loves Cuban music. His parents gave him these qualities which he adores but he is ""eternally grateful for his rich culinary skills that were passed on to him by his parents. @PERSON1 also talked about the role of ""family"" in the environment in which he grew up in. In his neighborhood, many people were the victims of racism, so they all came together to be a stronger whole. By growing up like this he learned how to give a helping hand to those who were in need. @PERSON1 also told the reader of the courage his parents had by leaving everything they knew and loved behind and how he wished he could have that same courage, but at least he knew of it.",3,3,,3,,,,,,,,,,,,,,,,,,,,,"ID1,ORG1,STY2"
4122,2,"Should certain materials, such as books, music, movies, magazines, etc., be removed from shelves if they are found offensive?     I do not think that certain materials should be removed for many reasons. Many different people have many different thoughts on whats offensive and what isn't like some people will find something funny that some people @MONTH1 think is nasty or inapropiate. If you was to take things off the shelves that someone found offensive there probably wouldn't be much left on the shelves because everybody has they're own oppenion. I agree that certain things shouldn't be seen by young eyes but thats the parents decision, not everyone has the same view on the material.     Certian materials should not be removed from shelves because of one persons oppenion on it. Everyone has they're own oppenion, some people like what other people don't everyone is different in they're own way",3,3,,3,3.0,3.0,,,,,,,,,,,,,,,,,,,"ID2,ORG2,STY3"
4761,2,Offensive things should be taken off for many reason that will be explained later on. Things in magazines shoud be appropriate for people to see. The first reason why they should be removed from the shelves is it might be offending to someone important like the president of the @ORGANIZATION1 or the @CAPS1 of your state.      If the subjects in the reading material are offensive to someone they should say something to defend themselves. If they don't speak up no one will think to change anything.     What I don't understand is why people would let that ridiculous stuff be put in the magazines and music and movies anyway.Even though movies are kind of different. Movies are mostly just made up ideas that people come up with. So if people are offended it is just pretend to begin with.      Offending things in books well the author probably has a reason for it. It might be something that is offending yet people need to know this in case it has to do with someone you know.For example in the Newspaper I read an article about our current president. @PERSON1 was being question about his birth certificate. People did not believe that he was born in @LOCATION1.      I personally think he was in fact born in the @CAPS2.S . But of course they did see his certificate that proved he was a member so that mess should be dropped and forgotton. It was uncalled for to begin with.     I wonder what was going through his head when someone asked him that question. I'm sure someone would have seen it before he even became president.,3,3,,3,3.0,3.0,,,,,,,,,,,,,,,,,,,"ID3,ORG2,STY2"
6302,3,"The feature of the setting affect the cyclist in many ways. When in the essay it states, “The sun was beginning to beat down” This shows that this affects how he feels when he is cycling through the road and this can affect his ability to keep cycling while the sun ??? him hard. Also when he states “I was doing a water-depleting 12 mph,” this shows he was also dehydrated once goin, very slow because of the ammount of heat and lack of water that affected his ability to keep cycling in the area.",2,2,,2,,,,,,,,,,,,,,,,,,,,,"ID2,ORG2,STY3"
453,1,"Dear local newspaper, @CAPS1 has come to my attention that computers have positive and negative effects on people. In the past their have been more negative effects on people. In a survey taken in @CAPS2 magazines @CAPS1 should that @PERCENT1 of people, have negative effects with computers. Inmy opinion, I think comuters have a negative effect on people. First, people are not interacting with family and friends. @CAPS1 is very important to have interactions with people. When on the computer your not really interacting with. You just sit there staring at a screen. In a survey taken at @CAPS3 @CAPS4 @CAPS1 should that @PERCENT2 of people are on computer and not interacting with the people around them. Parents don't se etheir kids as much because they are always on the computer. Parents would love to see their kids move. Interacting with their family and friends will be healthy to them. Computers take the away fromhanging out with family and friend. Secondly, people don't get to enjoy nature. People on computer might go outside because they are involved with the computer. Stay in one room doing the thing for books for a @CAPS5 in a while people need fresh air. too but learning about nature is more nature. If you dont enjoy nature you dont know what is going on.NAture is all around us and why would you miss out on. in a survey taken in a local magazine @CAPS1 should that @PERCENT2 of people are on computer and. While people enjoy computer, nature. Lastly, people are spending too much time on their computers and less time exercising. Exercise is important for the mind and body. Our bodies need to stay healthy and fit. The lack of exercise is increasing fast. The more people get computers the people exercise. America is over weight already to join the People on computers most just long to become over weight. People rather play on computer that got exercise for a healthy body. Dr. @DR1 a local doctor, has seen more people become over weight and not exercise as much as they used to. He says computers do not provide exercise. He recommends that people use their computers less computers are doing more. In conclusion, I think computer negative effect on. My three reasons are that people are not interacting with friends and family, not enjoying nature and getting less exercise. I you to be in of negative effects on people. @CAPS1's important decision is up to you. ",4,5,,9,,,,,,,,,,,,,,,,,,,,,"ID1,ORG2,STY2"
18689,7,"Patience is a very important virtue. It is valued in at least these @NUM1 aspects of life: success and friendship. If you do not possess patience no one will want to be your friend. You have to have patience with your friends or they will not be your friends. I know this from experience. In order to succeed in life in general you must have patience. Whether is waiting for the bus or waiting for a response from a job interview, it’ll always matter. So, in conclusion, I think that patience is a very, very important thing to have.",4,4,,8,,,0.0,1.0,1.0,2.0,,,0.0,1.0,1.0,2.0,,,,,,,,,"ID3,ORG2,STY3"
647,1,"Dear @LOCATION1, I believe that computers benifit the society. Computers help use in many ways but the @NUM1 main reasons are they help us store important documents get better at or learn forein language and get information. So without further adue here is more extensive reasonings. First of all, computers help us store many documents without computers companies that involve autioning and many other thing would have to store everything in filing cabinets. That would take forever and there wouldn't be enough room, so a lot of files would @CAPS1 be laying around every where @CAPS1 think about it. You use computers to make store send your newpaper articles and without computers you wouldn't be able to keep everybody up to date. Secondly they help use learn on get better at forien languages. Computers help use learn what other people are saying in other countries around the world. Like I have grandmother she the learned spanish. Now I can talk to her and she can understand me. Finally computers help use get information. They help us get information for a project at school, records direction, etc. In the year @DATE1 people din't have computers but when the first router was made the people I went up @NUM2 points. Farmers became slaves became very rich and I kid even grad collage at age @NUM3. So before you say people are spending too much fine on their computers and less time exercising, enjoying nature and interacting with family and friends think about what computers do for us @CAPS1 think. So furher more computers benifit us a lot. There's storing deviced helping us get better a lot learning a forign language and getting information. So please make te right chose and think about what computers do for us. ",6,5,,11,,,,,,,,,,,,,,,,,,,,,"ID2,ORG2,STY2"
610,1,"Dear @CAPS1 times, @CAPS2 people think that computers are good for socity but I do not. Computer's riskes out weighs the benighits. My first example is my father. My father never turned on a computer in his life and his buisness is doing fine. My father and his father has all of their records in a safe. One of my fathers friends had everything on his computer. When a virus hit it all of his files were gone and along with his records. My father handwrites all of his papers. He says if i need to type something out i'll buy a type writer. Also on things like facebook someone can see everything that another is doing. This is were alot of people pose as someone eles and thus @CAPS2 people get kidnapped or killed. A very good reason is that when people have alot of personal information when a virus hitls that person knows everything about you that you put on. For exampel i was watching a show on discovery channel when a man hacked into a myspace acount and used that persons name to people and try to create a cyder to the pentagon, that person almost got caught but never was. So you can see why my family does not like computers. My family is always at the farm or in the barn working on we have no time to be on the internet the only thing you need it for is school work. What ever happened to the old fasion way no computer, no problems.",3,4,,7,,,,,,,,,,,,,,,,,,,,,"ID2,ORG2,STY1"
9124,4,"well It seems like to me that the reason why the author wrote that as his or her ending is because basically to have sarcaism and put emphesis on what he was saying and making it clear that he wasn't going to take the test again, and basically if some one would haft to kill him in order to make him take that test again.",0,0,,0,,,,,,,,,,,,,,,,,,,,,"ID3,ORG2,STY2"
19314,7,"??? ??? ??? was about the mid of @DATE1 my family and I were going to ??? @LOCATION1. ???/ mid @LOCATION1. I was so excited  I ??? the days ??? with all of my ??? (part no legible) and accessories. I was pumped of ??? my mom and my brother pack the morning at the ??? my dad and I were all set. We packed everything in our old,??? can @NUM1 we headed off. An hour in I ask my dad “when are we going to be their?” “not until ??? (part not legible) my dad said for I slept. My brother was ??? stupid and rider ??? me in his ??? while I was sleeping. We stoped ??? him at a got station because my mom has to ???(part no legible) in and I start ??? (part not legible) was exited. It was about @NUM2. @NUM3 I had to wait to get to a hotel. I was still ??? because ??? wher in mid @LOCATION1 and ??? get to ??? and have an awesome time together. That was my story about the time I had to be patient.",10,8,,18,,,3.0,3.0,2.0,2.0,,,2.0,2.0,2.0,2.0,,,,,,,,,"ID3,ORG2,STY2"
9692,4,The authoR concludes the stoRy with that sentence b/c she wanted to explain to you that she will do this again when the hibiscus is back in season.,1,1,,1,,,,,,,,,,,,,,,,,,,,,"ID2,ORG2,STY2"
149,1,"Dear local Newspaper. I am stating my opinion that the more people use computers the less they spend with their family. I have three ressons why computer are good or bad. Not every one agrees that computer are benefitsal for the society. The positive effect and negative effect that computers have on people. My resson for supporting this @CAPS1 that computer are good or bad are that computers have a positive effect on people. The second @CAPS1 is to be able to talk to other people on line. The last @CAPS1 I have is Spending more time with family than on the computer. The first resson that i have for computers is how they have for computers is how they have positive effect on people. The examples that I have to Support this @CAPS1 are that computers tech hand eye coordination, computers given people the ability to Learn about far way place and peop. The second resson that I have on computers is that you talk to people online. The examples that I have to support my @CAPS1 are the website that kids us to talk to their friends like myspace and facebook. The place that kid like to go to are tutube and even blogging about everything and everyone. Some of theis thing can be good if you don't post picture or other this on your myspace or facebook. I think that these website are dangers because somebody can hack in to your file and they can try to talk to you like their your friend. The third resson I have to support my @CAPS1 is that we should spend more time with our family than being on the computer the whole time I have example on want we should do with or familys instead of being on the computers I have some @CAPS1 of games that we can play with our familys instead of being on the computers, The games that we can play with our familys are monopoly, somy, canda landy card, video games, we can also talk to our family instead of talking to our friends the whole time. When we can injoy want we have in live not just with computers but with our family. Inconclusion I am statting my opinion that the more time people spend on computers than with their own family. I have three resson on why computers are good or bad. The r\ess that I have to support my @CAPS1 are that computers have a positive effeck on people, to be able to talk to people online, To spend more time with family than on the computer.",4,4,,8,,,,,,,,,,,,,,,,,,,,,"ID2,ORG3,STY2"
4514,2,"Should books be removed from shelves if they are offensive? Who would determine if something is offensive or not and to whom it offends? These are just two questions that can create a high level of conflict and issues among many people. Would removing books from shelves limit our possibility to learn or see something from a different point of view?      First of all, who decides what is offensive and who it offends? It is possible for anything to offend anyone.  Also removing a book from the shelves could be offensive to the writter and the followers of the writter. Bringing up removing a book from shelves could cause more problems then just letting the book remain on the shelves. If offending others is the issue then would it not be better to leave it alone over all, rather than making it an issue to please one group but inturn upsetting another?      Secondly, could removing a book from the shelves limit your ability to learn something or hear something from another point of view? If books that offended people would have always been removed for reasons of offending other we could not have much of the knowledge we have today. For example a biology book might be offensive to people whos religion explains things differently and would make things untrue, and a religous document such as 'The @CAPS1 @CAPS2' or 'The @CAPS3' could be offensive to the people who believe the biology books to be true. If we removed both types of books from the shelves for being offensive, we would not have religion or modern science. This example could be used for any topic or genre of book because people can take many different things as offensive.      As a solution,  I believe it true that it is not possible to please everyone. If one person is pleased another is offended. If that person is pleased then the first person is offended. If books could possibly labeled as'some might take offensive' or 'material @MONTH1 be offensive' then people have a warning and they can choose if they want to read it or not. If they are offended they can not put blame on the author or where ever they got the book because there was a warning. It would  be just like the parental warnings on cd's. This @MONTH1 not fix the problem of people being offended, but it could very much reduce the amount of complaints about a book being offensive.     In conclusion, books should just be left on the shelves regardless of people complaining about them being offensive. Books being taken off shelves could turn into all books being taken off shelves which means no education or learning. That is just not an opition. Leaving books that offend certain people on the shelves @MONTH1 cause contraversy with others but if some sort of warning could be put in place and the proper procedures are preformed, the issues should decrease greatly. Think about all this the next time you want a book to be removed from the shelves",4,4,,4,4.0,4.0,,,,,,,,,,,,,,,,,,,"ID1,ORG1,STY2"
16418,6,"When something is getting invented or built, many obstacles are faced. The number one obstacle was safety. The wind at the top of the empire state building was another problem. The actual building was a problem too. All these problems and the architects tried to work around them, and failed.Safety is important, if one person dies per trip nobody is going to go on the ballon. Safety is important, no safety means no bussiniss. The wind was a huge problem. If the balloon won't stay still while unloading it is very unsafe. The skeleton of the building would have to change and that is an expensive fix. These are some of the major obstacles the architects faced. Maybe one day they will fix it.",2,2,,2,,,,,,,,,,,,,,,,,,,,,"ID3,ORG2,STY3"
9225,4,"The author concludes the story with the paragraph because the story was about her getting accustomed to things being repeated in nature, so she added the last paragraph saying that when everything happens again she will do the same. That is why the author concludes the story with the paragraph.",1,1,,1,,,,,,,,,,,,,,,,,,,,,"ID2,ORG2,STY2"
